
Filesystems usage for user tmanek ( uid 646266495 ):
-------------------------------------------------------------------------------------
Directory                       Used   Limit   Used,%         Files     Limit
-------------------------------------------------------------------------------------
/home/tmanek                    17KB    15GB     0.0%            29    100000
/data/tmanek                    11GB   200GB     5.4%         40232          
/scratch/tmanek                   0B    20TB     0.0%             1          

/shares/atomt.pilot.s3it.uzh   1.4GB    10TB     0.0%            13          
-------------------------------------------------------------------------------------

Files on /scratch may be purged after 30 days.
See https://docs.s3it.uzh.ch/cluster/data

sentencepiece_trainer.cc(178) LOG(INFO) Running command: --input=./toy_example/data/raw/train.cz --model_prefix=cz-bpe-1000 --pad_id=3 --vocab_size=1000 --model_type=bpe --unk_piece=<unk> --bos_piece=<s> --eos_piece=</s> --pad_piece=<pad>
sentencepiece_trainer.cc(78) LOG(INFO) Starts training with : 
trainer_spec {
  input: ./toy_example/data/raw/train.cz
  input_format: 
  model_prefix: cz-bpe-1000
  model_type: BPE
  vocab_size: 1000
  self_test_sample_size: 0
  character_coverage: 0.9995
  input_sentence_size: 0
  shuffle_input_sentence: 1
  seed_sentencepiece_size: 1000000
  shrinking_factor: 0.75
  max_sentence_length: 4192
  num_threads: 16
  num_sub_iterations: 2
  max_sentencepiece_length: 16
  split_by_unicode_script: 1
  split_by_number: 1
  split_by_whitespace: 1
  split_digits: 0
  pretokenization_delimiter: 
  treat_whitespace_as_suffix: 0
  allow_whitespace_only_pieces: 0
  required_chars: 
  byte_fallback: 0
  vocabulary_output_piece_score: 1
  train_extremely_large_corpus: 0
  seed_sentencepieces_file: 
  hard_vocab_limit: 1
  use_all_vocab: 0
  unk_id: 0
  bos_id: 1
  eos_id: 2
  pad_id: 3
  unk_piece: <unk>
  bos_piece: <s>
  eos_piece: </s>
  pad_piece: <pad>
  unk_surface:  ⁇ 
  enable_differential_privacy: 0
  differential_privacy_noise_level: 0
  differential_privacy_clipping_threshold: 0
}
normalizer_spec {
  name: nmt_nfkc
  add_dummy_prefix: 1
  remove_extra_whitespaces: 1
  escape_whitespaces: 1
  normalization_rule_tsv: 
}
denormalizer_spec {}
trainer_interface.cc(353) LOG(INFO) SentenceIterator is not specified. Using MultiFileSentenceIterator.
trainer_interface.cc(185) LOG(INFO) Loading corpus: ./toy_example/data/raw/train.cz
trainer_interface.cc(409) LOG(INFO) Loaded all 1000 sentences
trainer_interface.cc(425) LOG(INFO) Adding meta_piece: <unk>
trainer_interface.cc(425) LOG(INFO) Adding meta_piece: <s>
trainer_interface.cc(425) LOG(INFO) Adding meta_piece: </s>
trainer_interface.cc(425) LOG(INFO) Adding meta_piece: <pad>
trainer_interface.cc(430) LOG(INFO) Normalizing sentences...
trainer_interface.cc(539) LOG(INFO) all chars count=64563
trainer_interface.cc(550) LOG(INFO) Done: 99.9535% characters are covered.
trainer_interface.cc(560) LOG(INFO) Alphabet size=107
trainer_interface.cc(561) LOG(INFO) Final character coverage=0.999535
trainer_interface.cc(592) LOG(INFO) Done! preprocessed 1000 sentences.
trainer_interface.cc(598) LOG(INFO) Tokenizing input sentences with whitespace: 1000
trainer_interface.cc(609) LOG(INFO) Done! 5641
bpe_model_trainer.cc(159) LOG(INFO) Updating active symbols. max_freq=969 min_freq=3
bpe_model_trainer.cc(268) LOG(INFO) Added: freq=307 size=20 all=2313 active=1592 piece=ou
bpe_model_trainer.cc(268) LOG(INFO) Added: freq=182 size=40 all=3000 active=2279 piece=▁P
bpe_model_trainer.cc(268) LOG(INFO) Added: freq=125 size=60 all=3676 active=2955 piece=▁A
bpe_model_trainer.cc(268) LOG(INFO) Added: freq=96 size=80 all=4192 active=3471 piece=ka
bpe_model_trainer.cc(268) LOG(INFO) Added: freq=77 size=100 all=4818 active=4097 piece=dě
bpe_model_trainer.cc(159) LOG(INFO) Updating active symbols. max_freq=77 min_freq=8
bpe_model_trainer.cc(268) LOG(INFO) Added: freq=67 size=120 all=5274 active=1421 piece=du
bpe_model_trainer.cc(268) LOG(INFO) Added: freq=56 size=140 all=5815 active=1962 piece=ick
bpe_model_trainer.cc(268) LOG(INFO) Added: freq=48 size=160 all=6272 active=2419 piece=ad
bpe_model_trainer.cc(268) LOG(INFO) Added: freq=44 size=180 all=6688 active=2835 piece=▁re
bpe_model_trainer.cc(268) LOG(INFO) Added: freq=39 size=200 all=7037 active=3184 piece=ční
bpe_model_trainer.cc(159) LOG(INFO) Updating active symbols. max_freq=39 min_freq=7
bpe_model_trainer.cc(268) LOG(INFO) Added: freq=35 size=220 all=7356 active=1298 piece=▁kter
bpe_model_trainer.cc(268) LOG(INFO) Added: freq=32 size=240 all=7583 active=1525 piece=ít
bpe_model_trainer.cc(268) LOG(INFO) Added: freq=27 size=260 all=7846 active=1788 piece=sa
bpe_model_trainer.cc(268) LOG(INFO) Added: freq=25 size=280 all=8113 active=2055 piece=ved
bpe_model_trainer.cc(268) LOG(INFO) Added: freq=22 size=300 all=8289 active=2231 piece=ek
bpe_model_trainer.cc(159) LOG(INFO) Updating active symbols. max_freq=22 min_freq=6
bpe_model_trainer.cc(268) LOG(INFO) Added: freq=21 size=320 all=8523 active=1219 piece=stup
bpe_model_trainer.cc(268) LOG(INFO) Added: freq=20 size=340 all=8741 active=1437 piece=skyt
bpe_model_trainer.cc(268) LOG(INFO) Added: freq=19 size=360 all=8877 active=1573 piece=▁než
bpe_model_trainer.cc(268) LOG(INFO) Added: freq=18 size=380 all=8998 active=1694 piece=▁stát
bpe_model_trainer.cc(268) LOG(INFO) Added: freq=17 size=400 all=9178 active=1874 piece=▁tam
bpe_model_trainer.cc(159) LOG(INFO) Updating active symbols. max_freq=17 min_freq=5
bpe_model_trainer.cc(268) LOG(INFO) Added: freq=16 size=420 all=9316 active=1138 piece=stav
bpe_model_trainer.cc(268) LOG(INFO) Added: freq=15 size=440 all=9468 active=1290 piece=tel
bpe_model_trainer.cc(268) LOG(INFO) Added: freq=14 size=460 all=9612 active=1434 piece=kou
bpe_model_trainer.cc(268) LOG(INFO) Added: freq=14 size=480 all=9721 active=1543 piece=▁jejich
bpe_model_trainer.cc(268) LOG(INFO) Added: freq=13 size=500 all=9871 active=1693 piece=▁Le
bpe_model_trainer.cc(159) LOG(INFO) Updating active symbols. max_freq=13 min_freq=5
bpe_model_trainer.cc(268) LOG(INFO) Added: freq=12 size=520 all=9916 active=1038 piece=MA
bpe_model_trainer.cc(268) LOG(INFO) Added: freq=12 size=540 all=10040 active=1162 piece=▁jin
bpe_model_trainer.cc(268) LOG(INFO) Added: freq=11 size=560 all=10097 active=1219 piece=ke
bpe_model_trainer.cc(268) LOG(INFO) Added: freq=11 size=580 all=10282 active=1404 piece=▁ru
bpe_model_trainer.cc(268) LOG(INFO) Added: freq=10 size=600 all=10340 active=1462 piece=ké
bpe_model_trainer.cc(159) LOG(INFO) Updating active symbols. max_freq=10 min_freq=4
bpe_model_trainer.cc(268) LOG(INFO) Added: freq=10 size=620 all=10457 active=1109 piece=anov
bpe_model_trainer.cc(268) LOG(INFO) Added: freq=10 size=640 all=10543 active=1195 piece=▁musí
bpe_model_trainer.cc(268) LOG(INFO) Added: freq=9 size=660 all=10670 active=1322 piece=▁Ž
bpe_model_trainer.cc(268) LOG(INFO) Added: freq=9 size=680 all=10790 active=1442 piece=▁ov
bpe_model_trainer.cc(268) LOG(INFO) Added: freq=9 size=700 all=10874 active=1526 piece=▁pož
bpe_model_trainer.cc(159) LOG(INFO) Updating active symbols. max_freq=9 min_freq=4
bpe_model_trainer.cc(268) LOG(INFO) Added: freq=9 size=720 all=10911 active=1034 piece=▁svých
bpe_model_trainer.cc(268) LOG(INFO) Added: freq=8 size=740 all=10988 active=1111 piece=jem
bpe_model_trainer.cc(268) LOG(INFO) Added: freq=8 size=760 all=11092 active=1215 piece=▁lí
bpe_model_trainer.cc(268) LOG(INFO) Added: freq=8 size=780 all=11169 active=1292 piece=▁hle
bpe_model_trainer.cc(268) LOG(INFO) Added: freq=8 size=800 all=11214 active=1337 piece=▁také
bpe_model_trainer.cc(159) LOG(INFO) Updating active symbols. max_freq=8 min_freq=4
bpe_model_trainer.cc(268) LOG(INFO) Added: freq=8 size=820 all=11248 active=1035 piece=▁JavaScript
bpe_model_trainer.cc(268) LOG(INFO) Added: freq=7 size=840 all=11350 active=1137 piece=ene
bpe_model_trainer.cc(268) LOG(INFO) Added: freq=7 size=860 all=11464 active=1251 piece=ždy
bpe_model_trainer.cc(268) LOG(INFO) Added: freq=7 size=880 all=11527 active=1314 piece=nání
trainer_interface.cc(687) LOG(INFO) Saving model: cz-bpe-1000.model
trainer_interface.cc(699) LOG(INFO) Saving vocabs: cz-bpe-1000.vocab
INFO:root:Trained SentencePiece model for cz with 1000 words
sentencepiece_trainer.cc(178) LOG(INFO) Running command: --input=./toy_example/data/raw/train.en --model_prefix=en-bpe-1000 --pad_id=3 --vocab_size=1000 --model_type=bpe --unk_piece=<unk> --bos_piece=<s> --eos_piece=</s> --pad_piece=<pad>
sentencepiece_trainer.cc(78) LOG(INFO) Starts training with : 
trainer_spec {
  input: ./toy_example/data/raw/train.en
  input_format: 
  model_prefix: en-bpe-1000
  model_type: BPE
  vocab_size: 1000
  self_test_sample_size: 0
  character_coverage: 0.9995
  input_sentence_size: 0
  shuffle_input_sentence: 1
  seed_sentencepiece_size: 1000000
  shrinking_factor: 0.75
  max_sentence_length: 4192
  num_threads: 16
  num_sub_iterations: 2
  max_sentencepiece_length: 16
  split_by_unicode_script: 1
  split_by_number: 1
  split_by_whitespace: 1
  split_digits: 0
  pretokenization_delimiter: 
  treat_whitespace_as_suffix: 0
  allow_whitespace_only_pieces: 0
  required_chars: 
  byte_fallback: 0
  vocabulary_output_piece_score: 1
  train_extremely_large_corpus: 0
  seed_sentencepieces_file: 
  hard_vocab_limit: 1
  use_all_vocab: 0
  unk_id: 0
  bos_id: 1
  eos_id: 2
  pad_id: 3
  unk_piece: <unk>
  bos_piece: <s>
  eos_piece: </s>
  pad_piece: <pad>
  unk_surface:  ⁇ 
  enable_differential_privacy: 0
  differential_privacy_noise_level: 0
  differential_privacy_clipping_threshold: 0
}
normalizer_spec {
  name: nmt_nfkc
  add_dummy_prefix: 1
  remove_extra_whitespaces: 1
  escape_whitespaces: 1
  normalization_rule_tsv: 
}
denormalizer_spec {}
trainer_interface.cc(353) LOG(INFO) SentenceIterator is not specified. Using MultiFileSentenceIterator.
trainer_interface.cc(185) LOG(INFO) Loading corpus: ./toy_example/data/raw/train.en
trainer_interface.cc(409) LOG(INFO) Loaded all 1000 sentences
trainer_interface.cc(425) LOG(INFO) Adding meta_piece: <unk>
trainer_interface.cc(425) LOG(INFO) Adding meta_piece: <s>
trainer_interface.cc(425) LOG(INFO) Adding meta_piece: </s>
trainer_interface.cc(425) LOG(INFO) Adding meta_piece: <pad>
trainer_interface.cc(430) LOG(INFO) Normalizing sentences...
trainer_interface.cc(539) LOG(INFO) all chars count=68233
trainer_interface.cc(550) LOG(INFO) Done: 99.9531% characters are covered.
trainer_interface.cc(560) LOG(INFO) Alphabet size=91
trainer_interface.cc(561) LOG(INFO) Final character coverage=0.999531
trainer_interface.cc(592) LOG(INFO) Done! preprocessed 1000 sentences.
trainer_interface.cc(598) LOG(INFO) Tokenizing input sentences with whitespace: 1000
trainer_interface.cc(609) LOG(INFO) Done! 4646
bpe_model_trainer.cc(159) LOG(INFO) Updating active symbols. max_freq=1468 min_freq=1
bpe_model_trainer.cc(268) LOG(INFO) Added: freq=408 size=20 all=1857 active=1670 piece=▁o
bpe_model_trainer.cc(268) LOG(INFO) Added: freq=248 size=40 all=2354 active=2167 piece=ro
bpe_model_trainer.cc(268) LOG(INFO) Added: freq=148 size=60 all=2837 active=2650 piece=il
bpe_model_trainer.cc(268) LOG(INFO) Added: freq=103 size=80 all=3324 active=3137 piece=ly
bpe_model_trainer.cc(268) LOG(INFO) Added: freq=82 size=100 all=3759 active=3572 piece=▁with
bpe_model_trainer.cc(159) LOG(INFO) Updating active symbols. max_freq=81 min_freq=7
bpe_model_trainer.cc(268) LOG(INFO) Added: freq=68 size=120 all=4028 active=1267 piece=▁r
bpe_model_trainer.cc(268) LOG(INFO) Added: freq=60 size=140 all=4408 active=1647 piece=▁st
bpe_model_trainer.cc(268) LOG(INFO) Added: freq=51 size=160 all=4700 active=1939 piece=▁are
bpe_model_trainer.cc(268) LOG(INFO) Added: freq=43 size=180 all=5002 active=2241 piece=ice
bpe_model_trainer.cc(268) LOG(INFO) Added: freq=38 size=200 all=5204 active=2443 piece=um
bpe_model_trainer.cc(159) LOG(INFO) Updating active symbols. max_freq=38 min_freq=6
bpe_model_trainer.cc(268) LOG(INFO) Added: freq=34 size=220 all=5373 active=1145 piece=▁ac
bpe_model_trainer.cc(268) LOG(INFO) Added: freq=32 size=240 all=5558 active=1330 piece=▁up
bpe_model_trainer.cc(268) LOG(INFO) Added: freq=28 size=260 all=5761 active=1533 piece=▁ag
bpe_model_trainer.cc(268) LOG(INFO) Added: freq=26 size=280 all=5941 active=1713 piece=ost
bpe_model_trainer.cc(268) LOG(INFO) Added: freq=24 size=300 all=6083 active=1855 piece=▁pl
bpe_model_trainer.cc(159) LOG(INFO) Updating active symbols. max_freq=24 min_freq=5
bpe_model_trainer.cc(268) LOG(INFO) Added: freq=22 size=320 all=6238 active=1149 piece=cis
bpe_model_trainer.cc(268) LOG(INFO) Added: freq=20 size=340 all=6358 active=1269 piece=ft
bpe_model_trainer.cc(268) LOG(INFO) Added: freq=19 size=360 all=6497 active=1408 piece=▁qu
bpe_model_trainer.cc(268) LOG(INFO) Added: freq=18 size=380 all=6578 active=1489 piece=▁An
bpe_model_trainer.cc(268) LOG(INFO) Added: freq=17 size=400 all=6665 active=1576 piece=na
bpe_model_trainer.cc(159) LOG(INFO) Updating active symbols. max_freq=17 min_freq=5
bpe_model_trainer.cc(268) LOG(INFO) Added: freq=16 size=420 all=6750 active=1077 piece=ely
bpe_model_trainer.cc(268) LOG(INFO) Added: freq=15 size=440 all=6836 active=1163 piece=og
bpe_model_trainer.cc(268) LOG(INFO) Added: freq=15 size=460 all=6937 active=1264 piece=ouncil
bpe_model_trainer.cc(268) LOG(INFO) Added: freq=14 size=480 all=7062 active=1389 piece=stem
bpe_model_trainer.cc(268) LOG(INFO) Added: freq=13 size=500 all=7146 active=1473 piece=ine
bpe_model_trainer.cc(159) LOG(INFO) Updating active symbols. max_freq=13 min_freq=4
bpe_model_trainer.cc(268) LOG(INFO) Added: freq=12 size=520 all=7227 active=1070 piece=che
bpe_model_trainer.cc(268) LOG(INFO) Added: freq=12 size=540 all=7318 active=1161 piece=ating
bpe_model_trainer.cc(268) LOG(INFO) Added: freq=11 size=560 all=7414 active=1257 piece=ily
bpe_model_trainer.cc(268) LOG(INFO) Added: freq=11 size=580 all=7510 active=1353 piece=▁spe
bpe_model_trainer.cc(268) LOG(INFO) Added: freq=10 size=600 all=7563 active=1406 piece=iz
bpe_model_trainer.cc(159) LOG(INFO) Updating active symbols. max_freq=10 min_freq=4
bpe_model_trainer.cc(268) LOG(INFO) Added: freq=10 size=620 all=7677 active=1102 piece=ural
bpe_model_trainer.cc(268) LOG(INFO) Added: freq=10 size=640 all=7725 active=1150 piece=▁every
bpe_model_trainer.cc(268) LOG(INFO) Added: freq=9 size=660 all=7758 active=1183 piece=aug
bpe_model_trainer.cc(268) LOG(INFO) Added: freq=9 size=680 all=7838 active=1263 piece=vent
bpe_model_trainer.cc(268) LOG(INFO) Added: freq=9 size=700 all=7871 active=1296 piece=▁play
bpe_model_trainer.cc(159) LOG(INFO) Updating active symbols. max_freq=9 min_freq=4
bpe_model_trainer.cc(268) LOG(INFO) Added: freq=9 size=720 all=7884 active=1011 piece=▁Community
bpe_model_trainer.cc(268) LOG(INFO) Added: freq=8 size=740 all=7971 active=1098 piece=the
bpe_model_trainer.cc(268) LOG(INFO) Added: freq=8 size=760 all=8031 active=1158 piece=▁200
bpe_model_trainer.cc(268) LOG(INFO) Added: freq=8 size=780 all=8066 active=1193 piece=▁name
bpe_model_trainer.cc(268) LOG(INFO) Added: freq=8 size=800 all=8069 active=1196 piece=▁public
bpe_model_trainer.cc(159) LOG(INFO) Updating active symbols. max_freq=8 min_freq=3
bpe_model_trainer.cc(268) LOG(INFO) Added: freq=7 size=820 all=8106 active=1038 piece=arm
bpe_model_trainer.cc(268) LOG(INFO) Added: freq=7 size=840 all=8176 active=1108 piece=▁Tr
bpe_model_trainer.cc(268) LOG(INFO) Added: freq=7 size=860 all=8236 active=1168 piece=▁cam
bpe_model_trainer.cc(268) LOG(INFO) Added: freq=7 size=880 all=8270 active=1202 piece=▁spec
bpe_model_trainer.cc(268) LOG(INFO) Added: freq=7 size=900 all=8288 active=1220 piece=▁control
bpe_model_trainer.cc(159) LOG(INFO) Updating active symbols. max_freq=7 min_freq=3
trainer_interface.cc(687) LOG(INFO) Saving model: en-bpe-1000.model
trainer_interface.cc(699) LOG(INFO) Saving vocabs: en-bpe-1000.vocab
INFO:root:Trained SentencePiece model for en with 1000 words
INFO:root:Built a binary dataset for ./toy_example/data/raw/train.cz: 1000 sentences, 28939 tokens, 0.104% replaced by unknown token
INFO:root:Built a binary dataset for ./toy_example/data/raw/valid.cz: 100 sentences, 2917 tokens, 0.000% replaced by unknown token
INFO:root:Built a binary dataset for ./toy_example/data/raw/test.cz: 100 sentences, 3233 tokens, 0.031% replaced by unknown token
INFO:root:Built a binary dataset for ./toy_example/data/raw/train.en: 1000 sentences, 26495 tokens, 0.113% replaced by unknown token
INFO:root:Built a binary dataset for ./toy_example/data/raw/valid.en: 100 sentences, 2717 tokens, 0.074% replaced by unknown token
INFO:root:Built a binary dataset for ./toy_example/data/raw/test.en: 100 sentences, 3074 tokens, 0.000% replaced by unknown token
INFO:root:Data processing complete!
Vocabulary saved to toy_example/tokenizers/cz-bpe-1000.vocab
Vocabulary saved to toy_example/tokenizers/en-bpe-1000.vocab
Commencing training!
COMMAND: train.py --data toy_example/data/prepared/ --src-tokenizer toy_example/tokenizers/cz-bpe-1000.model --tgt-tokenizer toy_example/tokenizers/en-bpe-1000.model --source-lang cz --target-lang en --batch-size 32 --arch transformer --max-epoch 10 --log-file toy_example/logs/train.log --save-dir toy_example/checkpoints/ --ignore-checkpoints --encoder-dropout 0.1 --decoder-dropout 0.1 --dim-embedding 256 --attention-heads 4 --dim-feedforward-encoder 1024 --dim-feedforward-decoder 1024 --max-seq-len 100 --n-encoder-layers 3 --n-decoder-layers 3 --cuda
Arguments: {'cuda': True, 'data': 'toy_example/data/prepared/', 'source_lang': 'cz', 'target_lang': 'en', 'src_tokenizer': 'toy_example/tokenizers/cz-bpe-1000.model', 'tgt_tokenizer': 'toy_example/tokenizers/en-bpe-1000.model', 'max_tokens': None, 'batch_size': 32, 'train_on_tiny': False, 'arch': 'transformer', 'max_epoch': 10, 'clip_norm': 4.0, 'lr': 0.0003, 'patience': 3, 'max_length': 300, 'log_file': 'toy_example/logs/train.log', 'save_dir': 'toy_example/checkpoints/', 'restore_file': 'checkpoint_last.pt', 'save_interval': 1, 'no_save': False, 'epoch_checkpoints': False, 'ignore_checkpoints': True, 'encoder_dropout': 0.1, 'decoder_dropout': 0.1, 'dim_embedding': 256, 'attention_heads': 4, 'dim_feedforward_encoder': 1024, 'dim_feedforward_decoder': 1024, 'max_seq_len': 100, 'n_encoder_layers': 3, 'n_decoder_layers': 3, 'encoder_embed_path': None, 'decoder_embed_path': None, 'seed': 964331135}
Built a model with 6346472 parameters
| Epoch 000:   0%|          | 0/32 [00:00<?, ?it/s]| Epoch 000:   3%|▎         | 1/32 [00:02<01:06,  2.13s/it, loss=6.149, lr=0.0003, num_tokens=7.469, batch_size=32, grad_norm=18.57, clip=1]| Epoch 000:  78%|███████▊  | 25/32 [00:04<00:01,  6.97it/s, loss=5.506, lr=0.0003, num_tokens=20.16, batch_size=32, grad_norm=22.71, clip=1]                                                                                                                                             Epoch 000: loss 5.481 | lr 0.0003 | num_tokens 29.49 | batch_size 31.25 | grad_norm 29.43 | clip 1
Time to complete epoch 000 (training only): 4.76 seconds
| Validating Epoch 000:   0%|          | 0/4 [00:00<?, ?it/s]                                                             Epoch 000: valid_loss 5.38 | num_tokens 27.2 | batch_size 100 | valid_perplexity 218 | BLEU 0.000
| Epoch 001:   0%|          | 0/32 [00:00<?, ?it/s]| Epoch 001:  72%|███████▏  | 23/32 [00:02<00:00, 11.29it/s, loss=4.903, lr=0.0003, num_tokens=26.34, batch_size=30.96, grad_norm=20.79, clip=1]                                                                                                                                                Epoch 001: loss 4.927 | lr 0.0003 | num_tokens 29.49 | batch_size 31.25 | grad_norm 21.85 | clip 1
Time to complete epoch 001 (training only): 2.77 seconds
| Validating Epoch 001:   0%|          | 0/4 [00:00<?, ?it/s]| Validating Epoch 001:  25%|██▌       | 1/4 [00:04<00:13,  4.54s/it]| Validating Epoch 001:  50%|█████     | 2/4 [00:08<00:08,  4.35s/it]| Validating Epoch 001:  75%|███████▌  | 3/4 [00:12<00:04,  4.28s/it]| Validating Epoch 001: 100%|██████████| 4/4 [00:17<00:00,  4.28s/it]                                                                     Epoch 001: valid_loss 5.22 | num_tokens 27.2 | batch_size 100 | valid_perplexity 184 | BLEU 0.043
| Epoch 002:   0%|          | 0/32 [00:00<?, ?it/s]| Epoch 002:  75%|███████▌  | 24/32 [00:02<00:00, 11.72it/s, loss=4.722, lr=0.0003, num_tokens=33.27, batch_size=31, grad_norm=23.36, clip=1]                                                                                                                                             Epoch 002: loss 4.619 | lr 0.0003 | num_tokens 29.49 | batch_size 31.25 | grad_norm 21.64 | clip 1
Time to complete epoch 002 (training only): 2.68 seconds
| Validating Epoch 002:   0%|          | 0/4 [00:00<?, ?it/s]| Validating Epoch 002: 100%|██████████| 4/4 [00:04<00:00,  1.22s/it]                                                                     Epoch 002: valid_loss 5.07 | num_tokens 27.2 | batch_size 100 | valid_perplexity 160 | BLEU 0.028
| Epoch 003:   0%|          | 0/32 [00:00<?, ?it/s]| Epoch 003:  72%|███████▏  | 23/32 [00:02<00:00, 11.37it/s, loss=4.19, lr=0.0003, num_tokens=27.15, batch_size=30.96, grad_norm=22.61, clip=1]                                                                                                                                               Epoch 003: loss 4.322 | lr 0.0003 | num_tokens 29.49 | batch_size 31.25 | grad_norm 23.63 | clip 1
Time to complete epoch 003 (training only): 2.71 seconds
| Validating Epoch 003:   0%|          | 0/4 [00:00<?, ?it/s]| Validating Epoch 003:  25%|██▌       | 1/4 [00:04<00:13,  4.56s/it]| Validating Epoch 003:  50%|█████     | 2/4 [00:08<00:08,  4.34s/it]| Validating Epoch 003:  75%|███████▌  | 3/4 [00:12<00:04,  4.27s/it]| Validating Epoch 003: 100%|██████████| 4/4 [00:17<00:00,  4.25s/it]                                                                     Epoch 003: valid_loss 4.94 | num_tokens 27.2 | batch_size 100 | valid_perplexity 140 | BLEU 0.169
| Epoch 004:   0%|          | 0/32 [00:00<?, ?it/s]| Epoch 004:  78%|███████▊  | 25/32 [00:02<00:00, 12.41it/s, loss=3.994, lr=0.0003, num_tokens=31.26, batch_size=31.04, grad_norm=26.72, clip=1]                                                                                                                                                Epoch 004: loss 4.044 | lr 0.0003 | num_tokens 29.49 | batch_size 31.25 | grad_norm 25.46 | clip 1
Time to complete epoch 004 (training only): 2.54 seconds
| Validating Epoch 004:   0%|          | 0/4 [00:00<?, ?it/s]| Validating Epoch 004:  50%|█████     | 2/4 [00:04<00:04,  2.29s/it]| Validating Epoch 004:  75%|███████▌  | 3/4 [00:08<00:03,  3.07s/it]| Validating Epoch 004: 100%|██████████| 4/4 [00:12<00:00,  3.50s/it]                                                                     Epoch 004: valid_loss 4.83 | num_tokens 27.2 | batch_size 100 | valid_perplexity 126 | BLEU 0.131
| Epoch 005:   0%|          | 0/32 [00:00<?, ?it/s]| Epoch 005:  81%|████████▏ | 26/32 [00:02<00:00, 12.63it/s, loss=3.781, lr=0.0003, num_tokens=31.57, batch_size=31.08, grad_norm=25.16, clip=1]                                                                                                                                                Epoch 005: loss 3.78 | lr 0.0003 | num_tokens 29.49 | batch_size 31.25 | grad_norm 24.07 | clip 1
Time to complete epoch 005 (training only): 2.55 seconds
| Validating Epoch 005:   0%|          | 0/4 [00:00<?, ?it/s]| Validating Epoch 005:  50%|█████     | 2/4 [00:04<00:04,  2.38s/it]| Validating Epoch 005:  75%|███████▌  | 3/4 [00:08<00:03,  3.13s/it]| Validating Epoch 005: 100%|██████████| 4/4 [00:13<00:00,  3.54s/it]                                                                     Epoch 005: valid_loss 4.72 | num_tokens 27.2 | batch_size 100 | valid_perplexity 112 | BLEU 0.372
| Epoch 006:   0%|          | 0/32 [00:00<?, ?it/s]| Epoch 006:  78%|███████▊  | 25/32 [00:02<00:00, 12.48it/s, loss=3.445, lr=0.0003, num_tokens=28.57, batch_size=31.04, grad_norm=27.37, clip=1]                                                                                                                                                Epoch 006: loss 3.546 | lr 0.0003 | num_tokens 29.49 | batch_size 31.25 | grad_norm 28.68 | clip 1
Time to complete epoch 006 (training only): 2.57 seconds
| Validating Epoch 006:   0%|          | 0/4 [00:00<?, ?it/s]| Validating Epoch 006:  50%|█████     | 2/4 [00:04<00:04,  2.39s/it]| Validating Epoch 006:  75%|███████▌  | 3/4 [00:08<00:03,  3.14s/it]| Validating Epoch 006: 100%|██████████| 4/4 [00:13<00:00,  3.55s/it]                                                                     Epoch 006: valid_loss 4.66 | num_tokens 27.2 | batch_size 100 | valid_perplexity 106 | BLEU 0.349
| Epoch 007:   0%|          | 0/32 [00:00<?, ?it/s]| Epoch 007:  66%|██████▌   | 21/32 [00:02<00:01, 10.37it/s, loss=3.392, lr=0.0003, num_tokens=31.03, batch_size=30.86, grad_norm=27.94, clip=1]                                                                                                                                                Epoch 007: loss 3.34 | lr 0.0003 | num_tokens 29.49 | batch_size 31.25 | grad_norm 26.33 | clip 1
Time to complete epoch 007 (training only): 2.87 seconds
| Validating Epoch 007:   0%|          | 0/4 [00:00<?, ?it/s]| Validating Epoch 007:  50%|█████     | 2/4 [00:04<00:04,  2.37s/it]| Validating Epoch 007:  75%|███████▌  | 3/4 [00:08<00:03,  3.14s/it]| Validating Epoch 007: 100%|██████████| 4/4 [00:13<00:00,  3.55s/it]                                                                     Epoch 007: valid_loss 4.61 | num_tokens 27.2 | batch_size 100 | valid_perplexity 100 | BLEU 0.444
| Epoch 008:   0%|          | 0/32 [00:00<?, ?it/s]| Epoch 008:  69%|██████▉   | 22/32 [00:02<00:00, 10.99it/s, loss=3.066, lr=0.0003, num_tokens=27.49, batch_size=30.91, grad_norm=26.36, clip=1]                                                                                                                                                Epoch 008: loss 3.137 | lr 0.0003 | num_tokens 29.49 | batch_size 31.25 | grad_norm 27.24 | clip 1
Time to complete epoch 008 (training only): 2.78 seconds
| Validating Epoch 008:   0%|          | 0/4 [00:00<?, ?it/s]| Validating Epoch 008:  50%|█████     | 2/4 [00:04<00:04,  2.32s/it]| Validating Epoch 008:  75%|███████▌  | 3/4 [00:08<00:03,  3.09s/it]| Validating Epoch 008: 100%|██████████| 4/4 [00:13<00:00,  3.51s/it]                                                                     Epoch 008: valid_loss 4.57 | num_tokens 27.2 | batch_size 100 | valid_perplexity 96.5 | BLEU 0.243
| Epoch 009:   0%|          | 0/32 [00:00<?, ?it/s]| Epoch 009:  78%|███████▊  | 25/32 [00:02<00:00, 12.34it/s, loss=2.823, lr=0.0003, num_tokens=26.86, batch_size=31.04, grad_norm=26.78, clip=0.96]                                                                                                                                                   Epoch 009: loss 2.945 | lr 0.0003 | num_tokens 29.49 | batch_size 31.25 | grad_norm 29.07 | clip 0.9688
Time to complete epoch 009 (training only): 2.63 seconds
| Validating Epoch 009:   0%|          | 0/4 [00:00<?, ?it/s]| Validating Epoch 009:  75%|███████▌  | 3/4 [00:05<00:01,  1.79s/it]                                                                     Epoch 009: valid_loss 4.56 | num_tokens 27.2 | batch_size 100 | valid_perplexity 95.8 | BLEU 0.529
Loading the best model for final evaluation on the test set
Loaded checkpoint toy_example/checkpoints/checkpoint_last.pt
| Evaluating:   0%|          | 0/100 [00:00<?, ?it/s]| Evaluating:  30%|███       | 30/100 [00:02<00:04, 14.48it/s]| Evaluating:  59%|█████▉    | 59/100 [00:09<00:06,  5.92it/s]| Evaluating:  59%|█████▉    | 59/100 [00:21<00:06,  5.92it/s]| Evaluating:  69%|██████▉   | 69/100 [00:22<00:13,  2.34it/s]| Evaluating:  80%|████████  | 80/100 [00:28<00:09,  2.20it/s]| Evaluating:  91%|█████████ | 91/100 [00:30<00:03,  2.62it/s]                                                              Test set results: BLEU 0.179
Final Test Set Results: BLEU 0.18
[2025-10-09 21:51:21] COMMAND: translate.py --input toy_example/data/raw/test.cz --src-tokenizer toy_example/tokenizers/cz-bpe-1000.model --tgt-tokenizer toy_example/tokenizers/en-bpe-1000.model --checkpoint-path toy_example/checkpoints/checkpoint_best.pt --batch-size 1 --max-len 100 --output toy_example/toy_example_output.en --bleu --reference toy_example/data/raw/test.en --cuda
[2025-10-09 21:51:21] Arguments: {'cuda': True, 'data': 'toy_example/data/prepared/', 'source_lang': 'cz', 'target_lang': 'en', 'src_tokenizer': 'toy_example/tokenizers/cz-bpe-1000.model', 'tgt_tokenizer': 'toy_example/tokenizers/en-bpe-1000.model', 'max_tokens': None, 'batch_size': 1, 'train_on_tiny': False, 'arch': 'transformer', 'max_epoch': 10, 'clip_norm': 4.0, 'lr': 0.0003, 'patience': 3, 'max_length': 300, 'log_file': 'toy_example/logs/train.log', 'save_dir': 'toy_example/checkpoints/', 'restore_file': 'checkpoint_last.pt', 'save_interval': 1, 'no_save': False, 'epoch_checkpoints': False, 'ignore_checkpoints': True, 'encoder_dropout': 0.1, 'decoder_dropout': 0.1, 'dim_embedding': 256, 'attention_heads': 4, 'dim_feedforward_encoder': 1024, 'dim_feedforward_decoder': 1024, 'max_seq_len': 100, 'n_encoder_layers': 3, 'n_decoder_layers': 3, 'encoder_embed_path': None, 'decoder_embed_path': None, 'seed': 42, 'input': 'toy_example/data/raw/test.cz', 'checkpoint_path': 'toy_example/checkpoints/checkpoint_best.pt', 'output': 'toy_example/toy_example_output.en', 'max_len': 100, 'bleu': True, 'reference': 'toy_example/data/raw/test.en'}
[2025-10-09 21:51:22] Loaded a model from checkpoint toy_example/checkpoints/checkpoint_best.pt
PAD ID: 3, BOS ID: 1, EOS ID: 2
          PAD token: "<pad>", BOS token: "<s>", EOS token: "</s>"
0it [00:00, ?it/s]1it [00:00,  2.86it/s]3it [00:00,  6.76it/s]4it [00:00,  6.99it/s]5it [00:00,  7.42it/s]7it [00:00,  9.86it/s]9it [00:01,  9.44it/s]11it [00:01, 11.55it/s]13it [00:02,  4.99it/s]15it [00:02,  6.28it/s]18it [00:03,  4.77it/s]21it [00:03,  6.36it/s]23it [00:03,  7.04it/s]25it [00:03,  7.02it/s]27it [00:03,  8.47it/s]29it [00:04,  4.91it/s]31it [00:04,  6.27it/s]33it [00:05,  6.61it/s]35it [00:05,  7.84it/s]37it [00:05,  9.53it/s]39it [00:05,  8.43it/s]42it [00:06,  5.36it/s]44it [00:06,  6.26it/s]45it [00:06,  5.76it/s]50it [00:07, 10.74it/s]54it [00:07, 13.66it/s]57it [00:08,  6.95it/s]59it [00:08,  6.73it/s]61it [00:08,  7.63it/s]63it [00:08,  8.29it/s]68it [00:08, 13.69it/s]71it [00:09,  8.91it/s]73it [00:10,  5.44it/s]76it [00:11,  4.56it/s]78it [00:12,  3.63it/s]79it [00:12,  3.66it/s]81it [00:12,  4.44it/s]84it [00:12,  6.29it/s]86it [00:13,  4.29it/s]87it [00:13,  4.57it/s]88it [00:14,  3.06it/s]90it [00:14,  4.28it/s]92it [00:15,  3.32it/s]93it [00:15,  3.49it/s]95it [00:16,  4.59it/s]96it [00:16,  3.02it/s]98it [00:17,  2.75it/s]100it [00:17,  5.62it/s]
[2025-10-09 21:51:40] Wrote 100 lines to toy_example/toy_example_output.en
[2025-10-09 21:51:40] Translation completed in 17.78 seconds
BLEU score: 0.24
